{
  "schema_version": "teacher-role-workflow-workspace.v1",
  "tenant_id": "tenant_demo",
  "run_id": "run_demo",
  "round_id": "round_demo_1",
  "team_id": "team_alpha",
  "assignments": [],
  "sections": [],
  "section_summaries": [
    {
      "role_key": "CEO",
      "status": "missing",
      "version": 0
    }
  ],
  "merge_commits": [],
  "confirmations": [],
  "history": [],
  "known_limits": ["JSON_INTERNAL_ONLY", "COMPENSATING_ATOMICITY_NOT_CRASH_SAFE"]
}
